{
  "id": "minimal_scenario",
  "name": "Minimal Scenario",
  "version": "1.0.0",
  "chronicle_schema_version": 1,
  "files": {
    "config": "config.json",
    "world": "world.json",
    "npcs": "npcs.json",
    "facts": "facts.json",
    "flags": "flags.json",
    "events": "events.json"
  },
  "metadata": {
    "description": "A copyable two-room Chronicle starter package."
  }
}
