{
  "id": "broken_wheel_sample",
  "name": "Broken Wheel Sample",
  "version": "1.0.0",
  "chronicle_schema_version": 1,
  "files": {
    "config": "config.json",
    "world": "world.json",
    "npcs": "npcs.json",
    "facts": "facts.json",
    "flags": "flags.json",
    "events": "events.json"
  },
  "metadata": {
    "description": "A small NPC mystery/social-sim sample cartridge for the Chronicle runtime.",
    "author": "Chronicle Contributors",
    "license": "MIT"
  }
}
